play,audience,trigger,channel,offer_strategy,message_angle,owner,kpi,time_window,customers,value_pool
Protect premium drifters,High-value customers already sliding into fragile RFM states,"High-value customer enters Need Attention, At Risk, or Hibernating",Email + Push + Clienteling,"Service-led reminder, samples, loyalty perk; no blanket discount first",Protect the routine and the premium relationship,CRM + Loyalty,30-day reactivation and RFM recovery,Next 7 days,1062,"EUR 417,360"
Reactivate warm lapsed,Customers with decent path score but 60+ days of inactivity,Winning path score between 50 and 80 and no purchase for 60+ days,Email + Push + Paid retargeting,"Value-led reminder first, selective incentive only after no engagement",Rebuild the routine before the customer forgets it,CRM,30-day reactivation rate,Next 14 days,7879,"EUR 1,490,732"
Accelerate omnichannel growth,Repeat customers in growth or high-value states who are still mono-channel,Second purchase done within 60 days but customer still uses one channel only,App inbox + Website personalization + Store receipt / advisor,"Convenience and exclusivity, not price cuts",Show why the second channel makes the routine easier,CRM + Omnichannel,Omnichannel adoption within 45 days,Next 30 days,6753,"EUR 2,994,133"
Recover margin leakage,Repeat customers with upside still intact but discount reliance above 30%,Discount ratio above 30% with repeat behavior still present,CRM + Merchandising,"Bundles, gifts, replenishment cues, exclusives",Move the habit from price to routine and exclusivity,CRM + Merchandising,Margin per active customer,Next 30 days,504,"EUR 49,221"
Scale the best acquisition seed,Fragrance / Store / Discounted,Budget reallocation and welcome-journey planning,Acquisition + CRM onboarding,Replicate the first-basket mix and the first 30-day welcome sequence,"Acquire more customers who start the right routine, not just more customers",Acquisition + Merchandising,Margin per recruited customer,Next budget cycle,2410,"EUR 329,759"
